"« Être soi-même » cela a t-il un sens ? (CAPES 2023 - note : 14,5)"
"- être soi-même dans l'ipséité ce serait donc être un
Récit qui s'incarne dans le courage de la vérité sur soi.
Claude Romano prend plusieurs exemples dont celui de
Rousseau et de ses *confessions*. Si, comme il le reconnaît
lui-même, on trouve chez Rousseau beaucoup de pages
de sincérité n'est-on pas pour autant obligés de parler
[smudged/erased text] ici d'une sincérité-
inauthentique dans la mesure où chez Rousseau l'invention
de la société a semblé pervertir tout le monde sauf lui-même
Or s'il nous faut régler le dernier problème (au sens
de direction, de sens téléologique) qui classerait du"
"de direction, de sens téléologique) qui donnerait du
sens à ~être~ Soi-même comme à sa vertu, Foucault semble
à ce titre constituer un meilleur exemple. En effet dans
l'ouvrage dont se sert Romano pour mettre à jour sa
définition nouvelle de l'ipséité Foucault soutient que
le discours sur soi doit être courage de la vérité-
vertu pratique visant à la parresia révélation par discours
sur soi du sens d'être soi même. Dans *l'ordre du discours*
Foucault émet la thèse selon laquelle les discours
sont des régimes de vérité qui produisent des effets
politiques sur les agents qui en sont les victimes."
"politiques sur les agents qui en sont les victimes.
Le ""pouvoir de parler de nous"" serait en quelque
sorte une barrière sociale à l'expression de notre
ipséité et notre vertu consisterait, non pas à ~savoir~
fuir la société corruptrice et inventrice des moeurs
précieuses et ridicules mais faire face à la société :
analyser les discours de pouvoir sur soi que produisent
les institutions en droit de dire le vrai (justice, école,
médecine) et de s'en extraire par la vertu afin de
produire son propre discours sur soi (au double
sens de récit et d'action) et de donner non
seulement un sens au fait d'être soi mais"
"sens du récit et d'action) et de donner non
seulement un sens au fait d'être soi-même mais
aussi nous-mêmes, collectivement

* * *"
"Pour conclure si dans un premier temps nous cherchions,
par l'approche classique une solution à la ""question
du sujet"" et au sens à donner à cette dernière nous
avons relevés les contradictions inhérentes à la polysémie
du mot sens de l'approche classique (intériorité; devenir
téléologie) pour en préférer une approche plus dynamique
(qui s'accorde au soi comme action) mais aussi
au soi comme récit, récit qui ne donne du sens
à ""être soi-même"" qu'avec les autres dans le courage
de la vérité autant individuelle que collective."
de la vérité autant individuelle que collective.
ERROR: ValueError
ERROR: ValueError
